{
  "game_id": "test-game-01",
  "room_code": "TEST01",
  "game_mode": "CLASSIC",
  "winner": "VILLAGERS",
  "exported_at": "2026-06-01T10:00:00.000Z",
  "rounds": [
    {
      "round": 1,
      "checkpoints": [
        {
          "checkpoint": "BEFORE_VOTING",
          "labels": [
            {
              "id": "label-1",
              "created_at": "2026-06-01T09:05:30.000Z",
              "observer": {"id": "p-bravo", "name": "Bravo", "role": "VILLAGER"},
              "targets": [
                {
                  "player": {"id": "p-alpha", "name": "Alpha", "role": "WEREWOLF"},
                  "reasoning": "seems shifty",
                  "alignment": {"score": 2, "confidence": "HIGH"},
                  "information": null,
                  "consistency": {"score": 4, "confidence": "LOW"}
                },
                {
                  "player": {"id": "p-delta", "name": "Delta", "role": "VILLAGER"},
                  "reasoning": "died night one",
                  "alignment": {"score": 6, "confidence": "MEDIUM"},
                  "information": {"score": 5, "confidence": "MEDIUM"},
                  "consistency": {"score": 5, "confidence": "LOW"}
                }
              ]
            }
          ]
        }
      ]
    },
    {
      "round": 2,
      "checkpoints": [
        {
          "checkpoint": "BEFORE_DISCUSSION",
          "labels": [
            {
              "id": "label-2",
              "created_at": "2026-06-01T09:10:30.000Z",
              "observer": {"id": "p-carol", "name": "Carol", "role": "SEER"},
              "targets": [
                {
                  "player": {"id": "p-alpha", "name": "Alpha", "role": "WEREWOLF"},
                  "reasoning": "I investigated Alpha",
                  "alignment": {"score": 1, "confidence": "HIGH"},
                  "information": {"score": 2, "confidence": "HIGH"},
                  "consistency": {"score": 3, "confidence": "MEDIUM"}
                }
              ]
            }
          ]
        }
      ]
    }
  ]
}
